{
  "comparison_baseline": "冻结的 RegimeAwareV6（SHA256 1A422F41AB801746C2EE39F5D20722B26B674098BCA6AC1684E78BD8E7285509），相同 Runtime、费用、资金费、杠杆、风险参数与切片。",
  "contamination_risk": "low",
  "contradictory_evidence": [
    "research/analysis/regime-branch-audit/regime-branch-structure.json 的结论是不支持当前证据下直接修改策略结构，且各切片主导状态均为 range_low_volatility。",
    "research/analysis/strategy-family-reassessment/human-review-packet.json 已把共享 router 与方向分支的因子化列为优先结构方向，因此该切换事件假设可能只是既有结构问题的另一种表达。"
  ],
  "data_readiness": "ready",
  "estimated_cost": {
    "compute_class": "medium",
    "experiments": 8,
    "wall_clock_minutes": 45
  },
  "expected_information_gain": 0.78,
  "falsifiable_hypothesis": "在冻结的 BTC Development 四个时间切片中，4h regime 状态切换后仅接受 1h 同向动量确认的单一结构候选，相对 RegimeAwareV6 基线应在至少 3 个切片产生非零且可复现的独立交易差异，并且不得使任一切片最大回撤增加超过 2 个百分点；否则假设被否证。",
  "falsification_conditions": [
    "少于 3 个切片出现非零、可复现的独立交易差异。",
    "任一 RUN-A/RUN-B 的信号或规范化交易哈希不一致。",
    "任一切片最大回撤相对基线增加超过 2 个百分点。",
    "差异只能由相邻阈值变化而非状态切换机制解释。"
  ],
  "fixed_scope_confirmation": {
    "development_only": true,
    "exchange": "binance",
    "holdout_access": false,
    "informative_timeframes": [
      "4h"
    ],
    "margin_mode": "isolated",
    "market": "USD-M Futures",
    "new_dataset": false,
    "primary_timeframe": "1h",
    "risk_parameters_unchanged": true,
    "validation_access": false
  },
  "idea_id": "idea-regime-transition-momentum-v1",
  "idea_version": 1,
  "known_limitations": [
    "现有四个切片均被标注为 range_low_volatility，可能缺少足够的真实 regime 切换样本。",
    "该方向是结构变化，当前仅能提出，不能在本 discovery run 中创建 Candidate 或执行。",
    "Development 内发现的切换定义可能过拟合时间边界。"
  ],
  "minimal_test_method": "仅在另行人工批准后，冻结一个结构候选和四个既有 BTC Development 时间切片；每片以独立新 Python 进程运行 RUN-A/RUN-B，共 8 次，比较信号差异、规范化交易哈希、覆盖、最大回撤与 Balanced Research Gate Development 指标。",
  "novelty_vs_existing_research": "既有研究审计静态 regime 分支、方向贡献与共享 router；本方向把可观察对象限定为 regime 状态切换事件及其后的 1h 动量确认，不搜索已关闭阈值，也不改退出或风险参数。",
  "plain_language_summary_zh": "不再仅依赖静态 regime 标签，而是研究 4h 市场状态刚发生切换时，1h 价格是否出现可重复的同向动量确认；若无确认则保持空仓。",
  "proposed_market_mechanism": "市场从区间向趋势或从趋势向区间过渡时，价格发现可能短暂具有方向延续；把切换事件与 1h 同向动量确认组合，可检验静态 regime 路由是否遗漏了过渡期信息。",
  "required_datasets": [
    "futures-dev-btc-usdt-usdt-20240101-20240830-v2"
  ],
  "research_state_fingerprint": "61733452eb4e4b4be0ea1c6672cdb812e9f18c2115e3e3bd44830654cf248d49",
  "risk_class": "medium",
  "schema_version": "research-idea-v1",
  "semantic_fingerprint": "95b317ebacb1b4ecd8655072437d68c3dcd40ffadab797a6c192ed02c8ea6e19",
  "source_refs": [
    {
      "claim": "四个 BTC Development 切片的方向占比轮换且未观察到稳定单边失衡。",
      "path": "research/analysis/regime-branch-audit/regime-branch-structure.json",
      "source_class": "A"
    },
    {
      "claim": "冻结切片结果为 3 正 1 负，且每个切片 RUN-A/RUN-B 可复现。",
      "path": "research/temporal/stage3e1-temporal-comparison.json",
      "source_class": "A"
    },
    {
      "claim": "当前证据优先支持结构研究而非阈值搜索或退出改写。",
      "path": "research/analysis/strategy-family-reassessment/human-review-packet.json",
      "source_class": "A"
    }
  ],
  "stop_conditions": [
    "达到 8 次冻结实验预算即停止。",
    "首次出现运行时身份、数据哈希或输出命名空间不一致即停止。",
    "需要访问 Validation、Holdout、修改风险参数或引入第二个候选时停止并回到人工审批。"
  ],
  "strategy_family": "regime_transition_momentum",
  "supporting_evidence": [
    "research/analysis/regime-branch-audit/regime-branch-structure.json 显示四个切片的多空占比强烈轮换，属于结构性分布证据。",
    "research/temporal/stage3e1-temporal-comparison.json 显示 4 个冻结切片中 3 个为正、1 个为负，说明跨时间稳定性仍可能依赖状态变化。"
  ],
  "title": "4h 状态切换后的 1h 动量确认"
}
